law_id,law_name,hoofdstuk,hoofdstuk_titel,afdeling,afdeling_titel,paragraaf,paragraaf_titel,subparagraaf_titel,titel_titel,artikel,article_name,text
BWBR0002559,Uitleveringswet,HoofdstukI,Begripsbepalingen,Artikel1,,,,,,Artikel 1,,"In deze wet wordt verstaan onder: Onze Minister: Onze Minister van Justitie; uitlevering: verwijdering van een persoon uit Nederland met het doel hem ter beschikking te stellen van de autoriteiten van een andere Staat ten behoeve van hetzij een in die Staat tegen hem gericht strafrechtelijk onderzoek, hetzij de tenuitvoerlegging van een hem in die Staat opgelegde straf of maatregel; vreemdeling: ieder die de Nederlandse nationaliteit niet bezit en niet op grond van een wettelijke bepaling als Nederlander wordt behandeld; opgeëiste persoon: degene wiens uitlevering door een vreemde Mogendheid is verzocht; verzoekende staat: Mogendheid waarvan het verzoek tot uitlevering is uitgegaan. In deze wet wordt mede verstaan onder: Nederlands recht of recht van Nederland: het recht van Bonaire, Sint Eustatius en Saba; Nederlands strafrecht: het strafrecht van Bonaire, Sint Eustatius en Saba; Nederlandse wet: een wet die van kracht is in de openbare lichamen Bonaire, Sint Eustatius en Saba; Nederlandse rechter: de rechter in de openbare lichamen Bonaire, Sint Eustatius en Saba; Nederlands grondgebied of Nederlands gebied: het grondgebied van de openbare lichamen Bonaire, Sint Eustatius en Saba; in Nederland: in de openbare lichamen Bonaire, Sint Eustatius en Saba. Onder officier van justitie, hulpofficier van justitie en opsporingsambtenaar wordt uitsluitend voor de toepassing van de artikelen 13 tot en met 14, 16a, 17 en de artikelen 21 en 22a en 50a mede verstaan de officier van justitie van het openbaar ministerie van Bonaire, Sint Eustatius en Saba, de hulpofficier van justitie, bedoeld in artikel 191 van het Wetboek van Strafvordering BES, en de opsporingsambtenaar, bedoeld in artikel 184 van dat wetboek."
BWBR0002559,Uitleveringswet,HoofdstukII,Voorwaarden voor uitlevering,Artikel2,,,,,,Artikel 2,,Uitlevering geschiedt niet dan krachtens een verdrag.
BWBR0002559,Uitleveringswet,HoofdstukII,Voorwaarden voor uitlevering,Artikel3,,,,,,Artikel 3,,"Wanneer een van deze wet afwijkend verdrag aan de goedkeuring van de Staten-Generaal wordt onderworpen, doen Wij tevens een voorstel tot aanpassing van deze wet."
BWBR0002559,Uitleveringswet,HoofdstukII,Voorwaarden voor uitlevering,Artikel4,,,,,,Artikel 4,,"Nederlanders worden niet uitgeleverd. Het eerste lid is niet van toepassing indien de uitlevering van een Nederlander is gevraagd ten behoeve van een tegen hem gericht strafrechtelijk onderzoek en naar het oordeel van Onze Minister is gewaarborgd dat, zo hij ter zake van de feiten waarvoor zijn uitlevering kan worden toegestaan in de verzoekende Staat tot onvoorwaardelijke vrijheidsstraf wordt veroordeeld, hij deze straf in Nederland zal mogen ondergaan."
BWBR0002559,Uitleveringswet,HoofdstukII,Voorwaarden voor uitlevering,Artikel5,,,,,,Artikel 5,,"Uitlevering kan alleen worden toegestaan ten behoeve van: een door autoriteiten van de verzoekende staat ingesteld strafrechtelijk onderzoek ter zake van het vermoeden dat de opgeëiste persoon zich schuldig heeft gemaakt aan een feit waarvoor, zowel naar het recht van de verzoekende staat als naar dat van Nederland, een vrijheidsstraf van een jaar, of van langere duur, kan worden opgelegd; de tenuitvoerlegging van een vrijheidsstraf van vier maanden, of van langere duur, door de opgeëiste persoon op het grondgebied van de verzoekende staat te ondergaan wegens een feit als onder a bedoeld. Voor de toepassing van het voorgaande lid wordt onder een naar Nederlands recht strafbaar feit mede verstaan een feit waardoor inbreuk is gemaakt op de rechtsorde van de verzoekende staat, terwijl krachtens de Nederlandse wet een zelfde inbreuk op de Nederlandse rechtsorde of die van Bonaire, Sint Eustatius en Saba strafbaar is. Indien, in het geval bedoeld in het eerste lid, onder b, de veroordeling tot vrijheidsstraf bij verstek heeft plaatsgevonden, kan de uitlevering slechts worden toegestaan, indien de opgeëiste persoon in voldoende mate in de gelegenheid is geweest of alsnog zal worden gesteld om zijn verdediging te voeren."
BWBR0002559,Uitleveringswet,HoofdstukII,Voorwaarden voor uitlevering,Artikel6,,,,,,Artikel 6,,"Het in artikel 5, eerste lid, onder a, gestelde minimum van een jaar is niet van toepassing op uitlevering naar lidstaten van de Europese Unie, voorzover een tussen Nederland en deze lidstaten geldend verdrag in een ander minimum voorziet. Het in artikel 5, eerste lid, onder b, gestelde minimum van vier maanden is niet van toepassing op uitlevering naar België en Luxemburg."
BWBR0002559,Uitleveringswet,HoofdstukII,Voorwaarden voor uitlevering,Artikel7,,,,,,Artikel 7,,Voor de toepassing van deze wet worden gelijkgesteld: met vrijheidsstraffen: door de rechter naast of in plaats van een straf op te leggen maatregelen strekkende tot vrijheidsbeneming; met vrijheidsstraffen van langere duur dan een jaar: vrijheidsstraffen - met inbegrip van maatregelen als bedoeld onder a - voor de duur van het leven of voor onbepaalde tijd.
BWBR0002559,Uitleveringswet,HoofdstukII,Voorwaarden voor uitlevering,Artikel8,,,,,,Artikel 8,,"Indien, naar het recht van de verzoekende staat, de doodstraf is gesteld op het feit waarvoor de uitlevering is gevraagd, wordt de opgeëiste persoon niet uitgeleverd, tenzij naar het oordeel van Onze Minister voldoende is gewaarborgd dat die straf, zo een veroordeling daartoe mocht volgen, niet ten uitvoer zal worden gelegd."
BWBR0002559,Uitleveringswet,HoofdstukII,Voorwaarden voor uitlevering,Artikel9,,,,,,Artikel 9,,"Uitlevering van de opgeëiste persoon wordt niet toegestaan voor een feit terzake waarvan: ten tijde van de beslissing op het verzoek tot uitlevering een strafvervolging in Nederland tegen hem gaande is; hij in Nederland is vervolgd maar hernieuwde vervolging is uitgesloten op grond van artikel 255, eerste of tweede lid, of artikel 255a, eerste of tweede lid, van het Wetboek van Strafvordering onderscheidenlijk artikel 282, eerste en tweede lid, van het Wetboek van Strafvordering BES; hij bij gewijsde van de Nederlandse rechter is vrijgesproken of ontslagen van rechtsvervolging, dan wel te zijnen aanzien een overeenkomstige onherroepelijke beslissing door een andere rechter is genomen; hij bij rechterlijk gewijsde is veroordeeld, in gevallen waarin: de opgelegde straf of maatregel reeds is ondergaan, of die straf of maatregel niet voor onmiddellijke tenuitvoerlegging of verdere tenuitvoerlegging vatbaar is, of de veroordeling een schuldigverklaring zonder oplegging van straf of maatregel inhoudt, dan wel het gewijsde afkomstig is van de Nederlandse rechter en niet bij verdrag voor zodanig geval de bevoegdheid tot uitlevering is voorbehouden; naar Nederlands recht wegens verjaring geen vervolging, of, zo de uitlevering is gevraagd ten behoeve van de tenuitvoerlegging van een straf of maatregel, geen bestraffing meer kan plaatshebben. Het bepaalde in het vorige lid, aanhef en onder a, lijdt uitzondering in gevallen waarin Onze Minister bij zijn beslissing tot inwilliging van het verzoek tot uitlevering tevens opdracht geeft de vervolging te staken. Het bepaalde in het eerste lid, aanhef en onder b, lijdt uitzondering in gevallen waarin de vervolging in Nederland is gestaakt, hetzij omdat de Nederlandse strafwet op grond van de artikelen 2 tot en met 8d van het Wetboek van Strafrecht dan wel de strafwet van Bonaire, Sint Eustatius en Saba op grond van de artikelen 2 tot en met 8 van het Wetboek van Strafrecht BES niet van toepassing bleek te zijn, hetzij omdat aan berechting in het buitenland de voorkeur werd gegeven. Het eerste lid, aanhef en onder e, lijdt uitzondering voorzover krachtens het toepasselijke verdrag uitlevering niet kan worden geweigerd uitsluitend op grond van het feit dat het recht tot strafvervolging of het recht tot tenuitvoerlegging van die straf of maatregel naar het recht van de aangezochte staat is verjaard."
BWBR0002559,Uitleveringswet,HoofdstukII,Voorwaarden voor uitlevering,Artikel10,,,,,,Artikel 10,,"Uitlevering wordt niet toegestaan in gevallen waarin naar het oordeel van Onze Minister een gegrond vermoeden bestaat, dat bij inwilliging van het verzoek de opgeëiste persoon zal worden vervolgd, gestraft of op andere wijze getroffen in verband met zijn godsdienstige, levensbeschouwelijke of politieke overtuiging, zijn nationaliteit, zijn ras of de groep van de bevolking waartoe hij behoort. Uitlevering wordt niet toegestaan in gevallen waarin naar het oordeel van Onze Minister de gevolgen daarvan voor de opgeëiste persoon van bijzondere hardheid zouden zijn in verband met diens jeugdige leeftijd, hoge ouderdom of slechte gezondheidstoestand."
BWBR0002559,Uitleveringswet,HoofdstukII,Voorwaarden voor uitlevering,Artikel11,,,,,,Artikel 11,,"Uitlevering wordt niet toegestaan voor strafbare feiten van politieke aard, met inbegrip van daarmede samenhangende feiten. De aanslag tegen het leven of de vrijheid van een Staatshoofd of van een lid van het regerende Huis wordt niet beschouwd als een strafbaar feit van politieke aard in de zin van het gestelde in het vorige lid. Het eerste lid is niet van toepassing op uitlevering wegens een van de strafbare feiten, omschreven in de artikelen 1 en 2 van het Europees Verdrag tot bestrijding van terrorisme (Trb. 1977, 63), artikel 2 van het Verdrag inzake de bestrijding van terroristische bomaanslagen (Trb. 1998, 84), artikel 2 van het Internationaal Verdrag ter bestrijding van de financiering van terrorisme (Trb. 2000, 12) en artikel 7 van het Verdrag inzake de fysieke beveiliging van kernmateriaal (Trb. 1981, 7), zoals gewijzigd bij de op 8 juli 2005 te Wenen tot stand gekomen Wijziging van dat verdrag (Trb. 2006, 81), artikel 2 van het Internationaal Verdrag ter bestrijding van daden van nucleair terrorisme (Trb. 2005, 290), de artikelen 3, 3bis, 3ter of 3quater van het Verdrag tot bestrijding van wederrechtelijke gedragingen gericht tegen de veiligheid van de zeevaart (Trb. 1989, 17), zoals gewijzigd bij het Protocol van 2005 bij dat Verdrag (Trb. 2006, 223), en de artikelen 2, 2bis of 2ter van het Protocol tot bestrijding van wederrechtelijke gedragingen gericht tegen de veiligheid van vaste platforms op het continentale plat (Trb. 1989, 18), zoals gewijzigd bij het Protocol van 2005 bij dat Protocol (Trb. 2006, 224), artikel 1 van het Verdrag tot bestrijding van wederrechtelijke gedragingen betreffende de burgerluchtvaart (Trb. 2013, 134), artikel II van het Aanvullend Protocol bij het Verdrag tot bestrijding van het wederrechtelijk in zijn macht brengen van luchtvaartuigen (Trb. 2013, 133), de artikelen 5, 6, 7 en 9 van het Europees Verdrag ter voorkoming van terrorisme (Trb. 2006, 34) en de artikelen 2 tot en met 6 van het op 22 oktober 2015 te Riga tot stand gekomen Aanvullend Protocol bij het Verdrag van de Raad van Europa ter voorkoming van terrorisme (Trb. 2016, 180), aan een staat die gehouden is in een overeenkomstig geval uitlevering aan Nederland niet te weigeren wegens de politieke aard van het feit. Militaire delicten die niet tevens misdrijven naar algemeen Nederlands strafrecht zijn, en fiscale delicten kunnen geen aanleiding geven tot uitlevering, tenzij bij verdrag uitdrukkelijk anders is bepaald. Het in het vorige lid omtrent militaire delicten bepaalde is niet van toepassing op uitlevering naar België of Luxemburg."
BWBR0002559,Uitleveringswet,HoofdstukII,Voorwaarden voor uitlevering,Artikel12,,,,,,Artikel 12,,"Uitlevering wordt niet toegestaan dan onder het algemene beding, dat de opgeëiste persoon alleen met uitdrukkelijke toestemming van Onze Minister zal worden vervolgd, gestraft, of op enige andere wijze in zijn persoonlijke vrijheid beperkt, terzake van feiten die vóór het tijdstip van zijn uitlevering zijn begaan en waarvoor hij niet is uitgeleverd. Onze Minister kan de in het vorige lid bedoelde toestemming geven ten aanzien van: strafbare feiten waarvoor de opgeëiste persoon, krachtens het toepasselijke verdrag, aan de staat van wie het verzoek om toestemming is uitgegaan had kunnen worden uitgeleverd; andere feiten, voor zover deze zowel naar het recht van de staat van wie het verzoek om toestemming is uitgegaan als naar dat van Nederland strafbaar zijn en de mogelijkheid van uitlevering daarvoor niet krachtens de artikelen 8-11 van deze wet is uitgesloten. Uitlevering wordt voorts niet toegestaan dan onder het algemene beding, dat de opgeëiste persoon alleen met uitdrukkelijke toestemming van Onze Minister ter beschikking zal worden gesteld van de autoriteiten van een derde staat, terzake van feiten die vóór het tijdstip van zijn uitlevering zijn begaan. De toestemming kan worden gegeven ten aanzien van strafbare feiten waarvoor de opgeëiste persoon door Nederland aan de derde staat had kunnen worden uitgeleverd. De beslissing van Onze Minister op een verzoek om toestemming als bedoeld in het eerste en het derde lid wordt ter kennis van de staat van wie dat verzoek is uitgegaan gebracht langs diplomatieke weg, tenzij bij verdrag in een andere weg is voorzien. Het derde lid is van overeenkomstige toepassing op verzoeken van een lidstaat van de Europese Unie tot verderlevering aan een derde staat van een persoon die door Nederland onder het beding, bedoeld in artikel 14, vierde lid, van de Overleveringswet, werd overgeleverd aan de uitvaardigende justitiële autoriteit van die lidstaat. Ten aanzien van de lidstaten van de Europese Unie kan bij verdrag worden voorzien in uitzonderingen voor andere dan de in het vijfde lid bedoelde gevallen."
BWBR0002559,Uitleveringswet,HoofdstukIII,Procedure van uitlevering,AfdelingA,Voorlopige aanhouding,Artikel13,,,,Artikel 13,,"Voor zover een verdrag daarin voorziet, kan - in de gevallen omschreven in het volgende lid - op verzoek van de daartoe bevoegde autoriteit van een andere staat de voorlopige aanhouding worden bevolen van een zich in Nederland bevindende voortvluchtige, indien gegronde redenen bestaan voor de verwachting dat te zijnen aanzien op korte termijn vanwege die staat een voor inwilliging vatbaar verzoek tot uitlevering zal worden gedaan. De voorlopige aanhouding kan worden bevolen wanneer zij is verzocht: in verband met een strafrechtelijk onderzoek ter zake van het vermoeden dat de voortvluchtige zich heeft schuldig gemaakt aan een feit waarvoor naar Nederlands recht voorlopige hechtenis mogelijk is; met het oog op de tenuitvoerlegging van een vrijheidsstraf of van een maatregel als bedoeld in artikel 7 onder a; in andere dan de onder a en b voorziene gevallen, indien de voortvluchtige geen vaste woon- of verblijfplaats in Nederland heeft. Indien gegronde redenen bestaan voor de verwachting dat ten aanzien van een voortvluchtige die door de gezagvoerder van een luchtvaartuig na de landing in Nederland op grond van artikel 9, eerste lid, van het Verdrag inzake strafbare feiten en bepaalde andere handelingen begaan aan boord van luchtvaartuigen (Trb. 1964, nr. 115) is overgedragen, of die ervan wordt verdacht aan boord van het luchtvaartuig waarmee hij in Nederland is aangekomen een handeling als bedoeld in artikel 11, eerste lid, van dat Verdrag te hebben begaan, op korte termijn vanwege een der in artikel 13, vijfde lid, van het Verdrag genoemde staten een voor inwilliging vatbaar verzoek tot voorlopige aanhouding zal worden gedaan, kan de voorlopige aanhouding van die voortvluchtige worden bevolen, als ware zij reeds verzocht."
BWBR0002559,Uitleveringswet,HoofdstukIII,Procedure van uitlevering,AfdelingA,Voorlopige aanhouding,Artikel13a,,,,Artikel 13a,,"Een vreemdeling die op grond van artikel 54, vijfde lid, van het Wetboek van Strafvordering is aangehouden, kan op bevel van een officier of hulpofficier van justitie worden opgehouden, indien gegronde redenen bestaan voor de verwachting dat te zijnen aanzien onverwijld een verzoek om voorlopige aanhouding als bedoeld in artikel 13 zal worden gedaan. Artikel 56a, eerste tot en met derde lid, van het Wetboek is van overeenkomstige toepassing."
BWBR0002559,Uitleveringswet,HoofdstukIII,Procedure van uitlevering,AfdelingA,Voorlopige aanhouding,Artikel14,,,,Artikel 14,,"Iedere officier en hulpofficier van justitie is bevoegd de voorlopige aanhouding van een voortvluchtige overeenkomstig artikel 13 te bevelen. Kan het optreden van de officier van justitie en de hulpofficier niet worden afgewacht, dan is elke opsporingsambtenaar bevoegd de voortvluchtige aan te houden, onder de verplichting zorg te dragen dat hij onverwijld voor de officier van justitie of de hulpofficieren wordt geleid. Na de voortvluchtige te hebben gehoord, kan de officier of hulpofficier van justitie bevelen dat hij gedurende drie dagen, te rekenen van het tijdstip van de voorlopige aanhouding, in verzekering gesteld zal blijven. De hulpofficier geeft van zijn bevel ten spoedigste schriftelijk kennis aan de officier van justitie. De termijn van inverzekeringstelling kan door de officier van justitie éénmaal met drie dagen worden verlengd. De voortvluchtige kan te allen tijde door de officier van justitie in vrijheid worden gesteld. Zolang de termijn van inverzekeringstelling nog niet is verlengd, komt deze bevoegdheid mede toe aan de hulpofficier die het bevel tot de voorlopige aanhouding heeft gegeven."
BWBR0002559,Uitleveringswet,HoofdstukIII,Procedure van uitlevering,AfdelingA,Voorlopige aanhouding,Artikel15,,,,Artikel 15,,"De rechter-commissaris, belast met de behandeling van strafzaken, in de rechtbank van het arrondissement waarin een voortvluchtige overeenkomstig artikel 14 in verzekering is gesteld, kan, op vordering van de officier van justitie bij die rechtbank, de bewaring van de voortvluchtige bevelen. Alvorens een bevel ingevolge het vorige lid te geven, hoort de rechter-commissaris zo mogelijk de voortvluchtige."
BWBR0002559,Uitleveringswet,HoofdstukIII,Procedure van uitlevering,AfdelingA,Voorlopige aanhouding,Artikel16,,,,Artikel 16,,"Een voortvluchtige wiens bewaring overeenkomstig artikel 15 is bevolen, wordt - behoudens de mogelijkheid van verdere vrijheidsbeneming uit anderen hoofde - in vrijheid gesteld: zodra zulks door de rechtbank, de rechter-commissaris of de officier van justitie, ambtshalve of op verzoek van de voortvluchtige of diens raadsman, wordt gelast; zodra de termijn is verstreken binnen welke, volgens het toepasselijke verdrag, de voorlopige aanhouding moet worden gevolgd door een verzoek tot uitlevering, en zodanig verzoek niet inmiddels is gedaan; zodra de bewaring twintig dagen heeft geduurd. In gevallen waarin artikel 13, derde lid, toepassing vindt, worden de in het vorige lid, onder b en c, genoemde tijdvakken, na afloop waarvan de voortvluchtige in vrijheid moet worden gesteld, met vier dagen verlengd."
BWBR0002559,Uitleveringswet,HoofdstukIII,Procedure van uitlevering,AfdelingA,Voorlopige aanhouding,Artikel16a,,,,Artikel 16a,,"Indien een voortvluchtige in de openbare lichamen Bonaire, Sint Eustatius en Saba overeenkomstig deze afdeling in verzekering is gesteld, kan met het oog op de toepassing van het tweede lid de termijn van inverzekeringstelling uitsluitend door de officier van justitie bij het arrondissementsparket te Amsterdam éénmaal met drie dagen worden verlengd. Hem komt tevens uitsluitend de bevoegdheid van artikel 14, vijfde lid, toe. Indien een voortvluchtige in de openbare lichamen Bonaire, Sint Eustatius en Saba overeenkomstig deze afdeling in verzekering is gesteld, wordt hij binnen de termijnen van artikel 14, derde lid, en het eerste lid, overgedragen aan de officier van justitie bij het arrondissementsparket te Amsterdam. Het tweede lid kan buiten toepassing blijven indien de voortvluchtige tegenover de officier van justitie die hem hoort, heeft verklaard in te stemmen met zijn onmiddellijke uitlevering, de officier van justitie bij het arrondissementsparket te Amsterdam heeft beslist dat de voortvluchtige ter beschikking zal worden gesteld van de autoriteiten van de staat waarvan het verzoek tot voorlopige aanhouding is uitgegaan en de feitelijke uitlevering kan plaatsvinden binnen de termijnen van artikel 14, derde lid, en het eerste lid. Artikel 41, derde en vierde lid, is van overeenkomstige toepassing."
BWBR0002559,Uitleveringswet,HoofdstukIII,Procedure van uitlevering,AfdelingA,Voorlopige aanhouding,Artikel17,,,,Artikel 17,,"Van elke beslissing, genomen krachtens een der bepalingen van de artikelen 13 tot en met 16a, wordt onverwijld kennis gegeven aan Onze Minister."
BWBR0002559,Uitleveringswet,HoofdstukIII,Procedure van uitlevering,AfdelingB,Behandeling van het verzoek tot uitlevering,Artikel18,,,,Artikel 18,,"Een verzoek tot uitlevering kan slechts in overweging worden genomen, indien het voldoet aan de vereisten omschreven in de navolgende leden van dit artikel. Het verzoek moet schriftelijk worden gedaan, hetzij langs diplomatieke weg, hetzij - voor zover het toepasselijke verdrag daarin voorziet - rechtstreeks door toezending aan Onze Minister. Het verzoek moet vergezeld gaan van: het origineel of een authentiek afschrift hetzij van een, voor tenuitvoerlegging vatbaar, tegen de opgeëiste persoon gewezen strafvonnis, hetzij van een door de daartoe bevoegde autoriteit van de verzoekende staat gegeven bevel tot zijn aanhouding, of van een stuk dat dezelfde rechtskracht heeft, een en ander opgemaakt in de vorm voorgeschreven door het recht van die staat, en betrekking hebbende op de feiten waarvoor de uitlevering wordt gevraagd; een uiteenzetting van de feiten waarvoor de uitlevering wordt gevraagd, met een zo nauwkeurig mogelijke vermelding van de tijd en de plaats waarop deze zijn begaan; de tekst van de toepasselijke rechtsvoorschriften of, voorzover ongeschreven recht van toepassing is, een voor de beoordeling van het verzoek voldoende verklaring omtrent de inhoud van dat recht; de gegevens die nodig zijn voor het vaststellen van de identiteit van de opgeëiste persoon en - in geval van mogelijke twijfel daaromtrent - van zijn nationaliteit."
BWBR0002559,Uitleveringswet,HoofdstukIII,Procedure van uitlevering,AfdelingB,Behandeling van het verzoek tot uitlevering,Artikel19,,,,Artikel 19,,"Indien de overgelegde stukken naar het oordeel van Onze Minister niet voldoen aan de vereisten omschreven in artikel 18, of aan nadere vereisten gesteld in het toepasselijke verdrag, biedt hij de autoriteiten van de verzoekende staat gelegenheid tot aanvulling of verbetering, binnen een door hem te stellen redelijke termijn. In spoedeisende gevallen en voorzover een verdrag daarin voorziet kan de officier van justitie of de procureur-generaal bij de Hoge Raad, indien naar zijn oordeel, dat van de rechtbank of de Hoge Raad de overgelegde stukken niet voldoen aan de vereisten omschreven in artikel 18 of aan nadere vereisten gesteld in het toepasselijke verdrag welke ter beoordeling van de rechtbank of de Hoge Raad zijn, de door de verzoekende staat daartoe aangewezen autoriteiten gelegenheid bieden tot aanvulling of verbetering, binnen een door hem gestelde termijn."
BWBR0002559,Uitleveringswet,HoofdstukIII,Procedure van uitlevering,AfdelingB,Behandeling van het verzoek tot uitlevering,Artikel20,,,,Artikel 20,,"Tenzij Onze Minister reeds aanstonds van oordeel is dat het verzoek tot uitlevering moet worden afgewezen, stelt hij het verzoek met de daarbij behorende stukken - voor zover nodig na gelegenheid te hebben geboden tot aanvulling of verbetering overeenkomstig artikel 19 - in handen van de officier van justitie bij de rechtbank van het arrondissement waarin de opgeëiste persoon zich bevindt. Bevindt de opgeëiste persoon zich in de openbare lichamen Bonaire, Sint Eustatius en Saba, dan stelt hij de stukken in handen van de officier van justitie bij het arrondissementsparket Amsterdam. Wanneer een verzoek tot voorlopige aanhouding is voorafgegaan, worden de stukken toegezonden aan de officier van justitie die in verband met dat verzoek reeds bij de zaak betrokken is geweest. Indien dit verzoek een zich in de openbare lichamen Bonaire, Sint Eustatius en Saba bevindende voortvluchtige betreft, is het eerste lid, tweede volzin, van overeenkomstige toepassing. Indien tegen de opgeëiste persoon in het Europese deel van Nederland een strafvervolging gaande is, in verband waarmede hij voorlopig van zijn vrijheid is beroofd, of indien die persoon een in het Europese deel van Nederland opgelegde vrijheidsstraf ondergaat, kunnen, in afwijking van het voorgaande, de stukken worden toegezonden aan de officier van justitie die met de vervolging is belast of belast is geweest. Is voorshands niet bekend in welk arrondissement de opgeëiste persoon zich bevindt, staat de opgeëiste persoon gesignaleerd wegens een tegen hem afgegeven Europees aanhoudingsbevel of is zodanig bevel reeds ontvangen, dan zendt Onze Minister de stukken toe aan de officier van justitie bij het arrondissementsparket Amsterdam."
