law_id,law_name,hoofdstuk,hoofdstuk_titel,afdeling,afdeling_titel,paragraaf,paragraaf_titel,subparagraaf_titel,titel_titel,artikel,article_name,text
BWBR0008657,Wet arbeidsongeschiktheidsvoorziening jonggehandicapten,Hoofdstuk1,Algemene bepalingen,Artikel1:1,,,,,,Artikel 1:1,Algemene begrippen,"In deze wet en de daarop berustende bepalingen wordt verstaan onder: Onze Minister: Onze Minister van Sociale Zaken en Werkgelegenheid; Uitvoeringsinstituut werknemersverzekeringen: het Uitvoeringsinstituut werknemersverzekeringen, genoemd in hoofdstuk 5 van de Wet structuur uitvoeringsorganisatie werk en inkomen; Arbeidsongeschiktheidsfonds jonggehandicapten: het Arbeidsongeschiktheidsfonds jonggehandicapten, bedoeld in artikel 5:1; jonggehandicapte: de natuurlijke persoon, bedoeld in artikel 1a:1, artikel 2:3 of artikel 3:2; vreemdeling: hetgeen daaronder wordt verstaan in de Vreemdelingenwet 2000; rechtens zijn vrijheid is ontnomen: rechtens zijn vrijheid is ontnomen, behoudens de situaties, bedoeld in de Wet verplichte geestelijke gezondheidszorg, in de Wet zorg en dwang psychogeriatrische en verstandelijk gehandicapte cliënten en in artikel 2.3 van de Wet forensische zorg; justitiële inrichting: een penitentiaire inrichting, een instelling voor verpleging van ter beschikking gestelden, of een inrichting als bedoeld in artikel 1, onderdeel b, van de Beginselenwet justitiële jeugdinrichtingen; re-integratiebedrijf: een natuurlijke persoon dan wel rechtspersoon die in het kader van de uitoefening van beroep of bedrijf de inschakeling van personen in de arbeid bevordert; resterende verdiencapaciteit: het inkomen dat de jonggehandicapte die de leeftijd van achttien jaar nog niet heeft bereikt en de jonggehandicapte die recht heeft op een arbeidsongeschiktheidsuitkering of recht heeft op arbeidsondersteuning op grond van deze wet nog met arbeid kan verdienen en dat bij of krachtens artikel 2:5 of artikel 3:1 is vastgesteld; werknemer: een werknemer in de zin van de Wet werk en inkomen naar arbeidsvermogen; werkgever: een werkgever in de zin van de Wet werk en inkomen naar arbeidsvermogen; inkomensvoorziening: inkomensondersteuning als bedoeld in artikel 2:40 of een uitkering als bedoeld in artikel 2:45; minimumloon: het minimumloon, bedoeld in artikel 8, eerste lid, onderdeel b, van de Wet minimumloon en minimumvakantiebijslag of, indien het een persoon jonger dan 21 jaar betreft, het voor zijn leeftijd geldende minimumloon per maand, bedoeld in artikel 7, derde lid, en artikel 8, derde lid, van die wet; participatieplan: het participatieplan, bedoeld in artikel 2:18, eerste lid; recht op arbeidsondersteuning: het recht op arbeidsondersteuning op grond van hoofdstuk 2; arbeidsongeschiktheidsuitkering: een arbeidsongeschiktheidsuitkering op grond van hoofdstuk 1a of 3; zelfstandige: de persoon die, anders dan in dienstbetrekking, arbeid in eigen bedrijf verricht of een beroep uitoefent, teneinde daarmee inkomen te verwerven; vrijheidsstraf of vrijheidsbenemende maatregel: een bij onherroepelijk geworden vonnis opgelegde vrijheidsstraf of vrijheidsbenemende maatregel als bedoeld in het Wetboek van Strafrecht; uitreiziger: jonggehandicapte ten aanzien van wie op grond van een melding van de opsporingsdiensten of inlichtingen- en veiligheidsdiensten, gericht aan het Uitvoeringsinstituut werknemersverzekeringen, is gebleken dat het gegronde vermoeden bestaat dat deze persoon zich buiten Nederland bevindt met het doel om zich aan te sluiten bij een organisatie die is geplaatst op de lijst van organisaties, bedoeld in artikel 14, vierde lid, van de Rijkswet op het Nederlanderschap. In deze wet en de daarop berustende bepalingen wordt gelijkgesteld met: echtgenoot: geregistreerde partner; echtgenoten: geregistreerde partners; gehuwd: als partner geregistreerd. In deze wet en de daarop berustende bepalingen wordt: als gehuwd of als echtgenoot mede aangemerkt de ongehuwde meerderjarige die met een andere ongehuwde meerderjarige een gezamenlijke huishouding voert, tenzij het betreft een bloedverwant in de eerste graad; als ongehuwd mede aangemerkt degene die duurzaam gescheiden leeft van de persoon met wie hij gehuwd is. Van een gezamenlijke huishouding is sprake indien twee personen hun hoofdverblijf in dezelfde woning hebben en zij blijk geven zorg te dragen voor elkaar door middel van het leveren van een bijdrage in de kosten van de huishouding dan wel anderszins. Een gezamenlijke huishouding wordt in ieder geval aanwezig geacht indien de betrokkenen hun hoofdverblijf hebben in dezelfde woning en: zij met elkaar gehuwd zijn geweest of eerder voor de toepassing van deze wet daarmee gelijk zijn gesteld; uit hun relatie een kind is geboren of erkenning heeft plaatsgevonden van een kind van de een door de ander; zij zich wederzijds verplicht hebben tot een bijdrage aan de huishouding krachtens een geldend samenlevingscontract; of zij op grond van een registratie worden aangemerkt als een gezamenlijke huishouding die naar aard en strekking overeenkomt met de gezamenlijke huishouding, bedoeld in het vierde lid. Bij algemene maatregel van bestuur wordt vastgesteld welke registraties, en gedurende welk tijdvak, in aanmerking worden genomen voor de toepassing van het vijfde lid, onderdeel d. Bij algemene maatregel van bestuur kunnen regels worden gesteld ten aanzien van hetgeen wordt verstaan onder het blijk geven zorg te dragen voor een ander, zoals bedoeld in het vierde lid. Onder bloedverwant in de eerste graad als bedoeld in het derde lid, onderdeel a, wordt mede verstaan een meerderjarig aangehuwd kind of een meerderjarig voormalig pleegkind van de ongehuwde meerderjarige. Onder voormalig pleegkind als bedoeld in het achtste lid wordt verstaan een pleegkind voor wie de ongehuwde meerderjarige een pleegvergoeding ontving of ontvangt op grond van de Wet op de jeugdzorg of de Jeugdwet, of kinderbijslag ontving op grond van de Algemene Kinderbijslagwet."
BWBR0008657,Wet arbeidsongeschiktheidsvoorziening jonggehandicapten,Hoofdstuk1,Algemene bepalingen,Artikel1:2,,,,,,Artikel 1:2,Ingezetene,"Ingezetene in de zin van deze wet en de daarop berustende bepalingen is de natuurlijke persoon, die in Nederland woont. Bij of krachtens algemene maatregel van bestuur kan, in afwijking van het eerste lid, uitbreiding dan wel beperking worden gegeven aan het begrip «ingezetene». Voor de persoon die op grond van het tweede lid als ingezetene wordt aangemerkt, doch buiten Nederland woont, gelden de bepalingen van deze wet, met inachtneming van de specifieke regels die in deze wet ten aanzien van deze persoon zijn gesteld."
BWBR0008657,Wet arbeidsongeschiktheidsvoorziening jonggehandicapten,Hoofdstuk1,Algemene bepalingen,Artikel1:3,,,,,,Artikel 1:3,Woonplaats,"Waar een natuurlijk persoon woont wordt naar de omstandigheden beoordeeld. De persoon die Nederland metterwoon heeft verlaten en binnen een jaar nadien metterwoon terugkeert zonder inmiddels in Aruba, Curaçao, Sint Maarten, in de openbare lichamen Bonaire, Sint Eustatius en Saba of op het grondgebied van een andere Mogendheid te hebben gewoond, wordt ook voor de duur van zijn afwezigheid geacht in Nederland te hebben gewoond."
BWBR0008657,Wet arbeidsongeschiktheidsvoorziening jonggehandicapten,Hoofdstuk1,Algemene bepalingen,Artikel1:4,,,,,,Artikel 1:4,Studerenden,"In deze wet en de daarop berustende bepalingen wordt als studerende aangemerkt de persoon: die studiefinanciering, niet zijnde het levenlanglerenkrediet, ontvangt op grond van de Wet studiefinanciering 2000; die een financiële voorziening ontvangt als bedoeld in artikel 7.51, eerste lid, van de Wet op het hoger onderwijs en wetenschappelijk onderzoek; die een tegemoetkoming ontvangt op grond van hoofdstuk 4 van de Wet tegemoetkoming onderwijsbijdrage en schoolkosten; voor wie de verzekerde in de zin van de Algemene Kinderbijslagwet kinderbijslag ontvangt op grond van artikel 7, tweede lid, onderdeel a of onderdeel b, van die wet; die, hoewel hij niet op grond van de onderdelen a tot en met d als studerende wordt aangemerkt, niettemin in verband met onderwijs of een beroepsopleiding lessen of stages volgt gedurende gemiddeld ten minste 213 klokuren per kwartaal, voor zolang hij de leeftijd van 30 jaar nog niet heeft bereikt. Bij algemene maatregel van bestuur kunnen ook andere dan de in het eerste lid bedoelde personen als studerende worden aangemerkt."
BWBR0008657,Wet arbeidsongeschiktheidsvoorziening jonggehandicapten,Hoofdstuk1a,Arbeidsongeschiktheidsvoorziening voor jonggehandicapten,Paragraaf1,,Artikel1a:1,Jonggehandicapte,,,Artikel 1a:1,Jonggehandicapte,"Jonggehandicapte in de zin van dit hoofdstuk en de daarop berustende bepalingen is de ingezetene die: op de dag waarop hij achttien jaar wordt als rechtstreeks en objectief medisch vast te stellen gevolg van ziekte, gebrek, zwangerschap of bevalling duurzaam geen mogelijkheden tot arbeidsparticipatie heeft; na de in onderdeel a bedoelde dag als rechtstreeks en objectief medisch vast te stellen gevolg van ziekte, gebrek, zwangerschap of bevalling duurzaam geen mogelijkheden tot arbeidsparticipatie heeft en in het jaar, onmiddellijk voorafgaand aan de dag waarop dit is ingetreden, gedurende ten minste zes maanden studerende was. De ingezetene die op de dag, bedoeld in het eerste lid, onderdeel a of b, beperkingen ondervindt als gevolg van ziekte, gebrek, zwangerschap of bevalling, maar op grond van het eerste lid niet aangemerkt wordt als jonggehandicapte, wordt alsnog jonggehandicapte in de zin van dit hoofdstuk en de daarop berustende bepalingen, indien hij binnen vijf jaar na die dag duurzaam geen mogelijkheden tot arbeidsparticipatie heeft, indien dit voortkomt uit dezelfde oorzaak als die op grond waarvan hij beperkingen als gevolg van ziekte, gebrek, zwangerschap of bevalling ondervond, op de dag, bedoeld in onderdeel a of b. De ingezetene die tijdelijk geen mogelijkheden tot arbeidsparticipatie heeft wordt alsnog jonggehandicapte, indien hij gedurende een tijdvak van tien jaar volgend op de dag waarop hij jonggehandicapte zou zijn geworden op grond van het eerste lid, onderdeel a of b, of het tweede lid, indien hij duurzaam geen mogelijkheden tot arbeidsparticipatie zou hebben gehad, geen mogelijkheden tot arbeidsparticipatie had. Onder duurzaam geen mogelijkheden tot arbeidsparticipatie hebben wordt in dit hoofdstuk en de daarop berustende bepalingen de situatie verstaan waarin de mogelijkheden tot arbeidsparticipatie zich niet kunnen ontwikkelen. Bij of krachtens algemene maatregel van bestuur kunnen regels worden gesteld met betrekking tot een periodieke herbeoordeling om vast te stellen of betrokkene duurzaam geen mogelijkheden tot arbeidsparticipatie heeft. De beoordeling van de mogelijkheden tot arbeidsparticipatie wordt gebaseerd op een verzekeringsgeneeskundig en voor zover nodig een arbeidskundig onderzoek. Bij de beoordeling, bedoeld in het zesde lid, maakt de verzekeringsarts zo veel mogelijk gebruik van wetenschappelijke inzichten die de beoordeling van de mogelijkheden tot arbeidsparticipatie kunnen ondersteunen. Bij of krachtens algemene maatregel van bestuur kunnen met betrekking tot het eerste, vierde en zesde lid nadere regels worden gesteld. De voordracht voor een krachtens het achtste lid vast te stellen algemene maatregel van bestuur, dan wel de vaststelling van een ministeriële regeling op basis van een dergelijke algemene maatregel van bestuur, wordt niet eerder gedaan dan vier weken nadat het ontwerp aan beide Kamers der Staten-Generaal is overgelegd."
BWBR0008657,Wet arbeidsongeschiktheidsvoorziening jonggehandicapten,Hoofdstuk1a,Arbeidsongeschiktheidsvoorziening voor jonggehandicapten,Paragraaf2,,Artikel1a:2,Recht op arbeidsongeschiktheidsuitkering,,,Artikel 1a:2,Recht op arbeidsongeschiktheidsuitkering,"De jonggehandicapte heeft recht op een arbeidsongeschiktheidsuitkering op grond van dit hoofdstuk, tenzij op hem een uitsluitingsgrond, als bedoeld in artikel 1a:6, eerste lid, van toepassing is. De persoon die recht op arbeidsondersteuning op grond van hoofdstuk 2 of recht op arbeidsongeschiktheidsuitkering op grond van hoofdstuk 3 heeft of heeft gehad, heeft geen recht op arbeidsongeschiktheidsuitkering op grond van dit hoofdstuk."
BWBR0008657,Wet arbeidsongeschiktheidsvoorziening jonggehandicapten,Hoofdstuk1a,Arbeidsongeschiktheidsvoorziening voor jonggehandicapten,Paragraaf2,,Artikel1a:3,Recht op arbeidsongeschiktheidsuitkering,,,Artikel 1a:3,Later ontstaan recht op arbeidsongeschiktheidsuitkering,"Indien is vastgesteld dat de ingezetene geen jonggehandicapte is, heeft de ingezetene die alsnog wordt aangemerkt als jonggehandicapte op grond van artikel 1a:1, tweede lid, niet eerder dan twaalf maanden na de dag waarop voor het laatst werd vastgesteld dat de ingezetene geen jonggehandicapte was recht op arbeidsongeschiktheidsuitkering. Indien geen recht op arbeidsongeschiktheidsuitkering ontstaat, omdat op de jonggehandicapte een of meer uitsluitingsgronden, als bedoeld in artikel 1a:6, eerste lid, van toepassing zijn, heeft de jonggehandicapte alsnog recht op arbeidsongeschiktheidsuitkering vanaf de dag dat zich geen van deze uitsluitingsgronden meer voordoet."
BWBR0008657,Wet arbeidsongeschiktheidsvoorziening jonggehandicapten,Hoofdstuk1a,Arbeidsongeschiktheidsvoorziening voor jonggehandicapten,Paragraaf2,,Artikel1a:4,Recht op arbeidsongeschiktheidsuitkering,,,Artikel 1a:4,Hoogte arbeidsongeschiktheidsuitkering,"De arbeidsongeschiktheidsuitkering wordt berekend naar de grondslag van het minimumloon per maand gedeeld door 21,75. De arbeidsongeschiktheidsuitkering bedraagt per dag 0,75 * (G – I). De G staat voor de grondslag en I voor het inkomen per dag. Bij algemene maatregel van bestuur wordt bepaald wat onder inkomen per dag in de zin van dit hoofdstuk wordt verstaan. Daarbij kan tevens worden bepaald dat nader te bepalen inkomen dat gedeeltelijk, niet, of niet langer wordt genoten als gevolg van gewijzigde omstandigheden of enig handelen of nalaten van betrokkene in aanmerking wordt genomen alsof het wel volledig wordt genoten."
BWBR0008657,Wet arbeidsongeschiktheidsvoorziening jonggehandicapten,Hoofdstuk1a,Arbeidsongeschiktheidsvoorziening voor jonggehandicapten,Paragraaf2,,Artikel1a:5,Recht op arbeidsongeschiktheidsuitkering,,,Artikel 1a:5,Verhoging bij hulpbehoevendheid,"Indien de jonggehandicapte verkeert in een blijvende of voorlopig blijvende toestand van hulpbehoevendheid die geregeld oppassing en verzorging nodig maakt, wordt de arbeidsongeschiktheidsuitkering voor de duur van die hulpbehoevendheid verhoogd tot ten hoogste de grondslag. De eerste zin vindt geen toepassing, indien de jonggehandicapte in een inrichting is opgenomen en de kosten van verblijf ten laste van een zorgverzekering of een verzekering inzake ziektekosten komen."
BWBR0008657,Wet arbeidsongeschiktheidsvoorziening jonggehandicapten,Hoofdstuk1a,Arbeidsongeschiktheidsvoorziening voor jonggehandicapten,Paragraaf2,,Artikel1a:6,Recht op arbeidsongeschiktheidsuitkering,,,Artikel 1a:6,Uitsluitingsgronden,"Voor de toepassing van deze paragraaf en de daarop berustende bepalingen worden de volgende uitsluitingsgronden onderscheiden: het rechtens zijn vrijheid zijn ontnomen; het zich onttrekken aan de tenuitvoerlegging van een vrijheidsstraf of vrijheidsbenemende maatregel; het niet in Nederland wonen; het als vreemdeling niet rechtmatig verblijf houden in de zin van artikel 8, onderdelen a tot en met e en l, van de Vreemdelingenwet 2000; het bereiken of bereikt hebben van de pensioengerechtigde leeftijd, bedoeld in artikel 7a, eerste lid, van de Algemene Ouderdomswet; een uitreiziger zijn. Bij algemene maatregel van bestuur kan worden bepaald dat de uitsluitingsgrond, bedoeld in het eerste lid, onderdeel d, niet geldt ten aanzien van vreemdelingen die, na rechtmatig verblijf te hebben gehouden in de zin van artikel 8, onderdeel a tot en met e en l, van de Vreemdelingenwet 2000, rechtmatig in Nederland verblijf hebben als bedoeld in artikel 8, onderdeel g of h, van de Vreemdelingenwet 2000."
BWBR0008657,Wet arbeidsongeschiktheidsvoorziening jonggehandicapten,Hoofdstuk1a,Arbeidsongeschiktheidsvoorziening voor jonggehandicapten,Paragraaf2,,Artikel1a:7,Recht op arbeidsongeschiktheidsuitkering,,,Artikel 1a:7,Nadere bepalingen met betrekking tot vrijheidsstraffen en vrijheidsbenemende maatregelen,"In afwijking van de artikelen 1a:2, eerste lid, en 1a:9 is artikel 1a:6, eerste lid, onderdeel a, eerst van toepassing met ingang van de dag dat de persoon één maand rechtens zijn vrijheid is ontnomen, tenzij op de dag voorafgaande aan de vrijheidsontneming geen recht bestaat op arbeidsongeschiktheidsuitkering op grond van artikel 1a:6, eerste lid, onderdeel b. Artikel 1a:6, eerste lid, onderdeel a, is niet van toepassing op bij algemene maatregel van bestuur aan te wijzen categorieën personen waarbij tenuitvoerlegging van een vrijheidsstraf of vrijheidsbenemende maatregel plaatsvindt buiten een justitiële inrichting. Voor de toepassing van het eerste lid, worden perioden van vrijheidsontneming samengeteld, indien zij elkaar met een onderbreking van minder dan vier weken opvolgen."
BWBR0008657,Wet arbeidsongeschiktheidsvoorziening jonggehandicapten,Hoofdstuk1a,Arbeidsongeschiktheidsvoorziening voor jonggehandicapten,Paragraaf2,,Artikel1a:8,Recht op arbeidsongeschiktheidsuitkering,,,Artikel 1a:8,Niet in Nederland wonen,"In afwijking van de artikelen 1a:2, eerste lid, en 1a:9 is artikel 1a:6, eerste lid, onderdeel c, eerst van toepassing met ingang van de eerste dag van de maand volgend op die waarin de jonggehandicapte buiten Nederland is gaan wonen. Het eerste lid is tevens van toepassing op de jonggehandicapte die buiten Nederland is gaan wonen en op wie artikel 1:2, derde lid, van toepassing is. Het Uitvoeringsinstituut werknemersverzekeringen kan artikel 1a:6, eerste lid, onderdeel c, buiten toepassing laten of daarvan afwijken voor zover toepassing, gelet op het belang van het eindigen van het recht op arbeidsongeschiktheidsuitkering indien de jonggehandicapte buiten Nederland gaat wonen, zal leiden tot een onbillijkheid van overwegende aard."
BWBR0008657,Wet arbeidsongeschiktheidsvoorziening jonggehandicapten,Hoofdstuk1a,Arbeidsongeschiktheidsvoorziening voor jonggehandicapten,Paragraaf2,,Artikel1a:9,Recht op arbeidsongeschiktheidsuitkering,,,Artikel 1a:9,Einde van het recht op arbeidsongeschiktheidsuitkering,"Het recht op arbeidsongeschiktheidsuitkering eindigt: wanneer de jonggehandicapte mogelijkheden tot arbeidsparticipatie als bedoeld in artikel 1a:1 heeft, met ingang van de dag, aangegeven in de daartoe strekkende beschikking van het Uitvoeringsinstituut werknemersverzekeringen; op de dag dat er op de jonggehandicapte een uitsluitingsgrond als bedoeld in artikel 1a:6, eerste lid, van toepassing is; indien het Uitvoeringsinstituut werknemersverzekeringen daartoe op verzoek van de jonggehandicapte besluit; of indien de jonggehandicapte overlijdt."
BWBR0008657,Wet arbeidsongeschiktheidsvoorziening jonggehandicapten,Hoofdstuk1a,Arbeidsongeschiktheidsvoorziening voor jonggehandicapten,Paragraaf2,,Artikel1a:10,Recht op arbeidsongeschiktheidsuitkering,,,Artikel 1a:10,Herleving van het recht op arbeidsongeschiktheidsuitkering,"Indien op grond van artikel 1a:9, onderdeel a, het recht op arbeidsongeschiktheidsuitkering is geëindigd, herleeft het recht op arbeidsongeschiktheidsuitkering als de jonggehandicapte duurzaam geen mogelijkheden tot arbeidsparticipatie als bedoeld in artikel 1a:1 heeft. Indien op grond van artikel 1a:9, onderdeel b, het recht op arbeidsongeschiktheidsuitkering is geëindigd, omdat op de persoon die recht had op arbeidsongeschiktheidsuitkering een of meer uitsluitingsgronden als bedoeld in artikel 1a:6, eerste lid, onderdelen a tot en met d en onderdeel f, van toepassing waren, herleeft het recht op arbeidsongeschiktheidsuitkering wanneer zich geen van deze uitsluitingsgronden meer voordoet. Indien op grond van artikel 1a:9, onderdeel c, het recht op arbeidsongeschiktheidsuitkering is geëindigd, herleeft het recht op arbeidsongeschiktheidsuitkering op aanvraag van de jonggehandicapte, indien zich geen uitsluitingsgrond als bedoeld in artikel 1a:6, eerste lid, voordoet. Het recht op arbeidsongeschiktheidsuitkering herleeft niet eerder dan een jaar na de dag waarop het recht op arbeidsongeschiktheidsuitkering is geëindigd."
BWBR0008657,Wet arbeidsongeschiktheidsvoorziening jonggehandicapten,Hoofdstuk1a,Arbeidsongeschiktheidsvoorziening voor jonggehandicapten,Paragraaf2,,Artikel1a:11,Recht op arbeidsongeschiktheidsuitkering,,,Artikel 1a:11,Aanvraag recht op arbeidsongeschiktheidsuitkering,"Het Uitvoeringsinstituut werknemersverzekeringen stelt op aanvraag vast of recht op arbeidsongeschiktheidsuitkering op grond van dit hoofdstuk bestaat. Het recht op arbeidsongeschiktheidsuitkering op grond van dit hoofdstuk ontstaat op de dag waarop de aanvraag, bedoeld in dit artikel, werd ingediend, met dien verstande dat dit recht niet eerder kan ontstaan dan de dag waarop de betrokkene achttien jaar wordt. Bij ministeriële regeling kunnen regels worden gesteld met betrekking tot de gegevens die door de jonggehandicapte bij de aanvraag worden verstrekt. Indien de toepassing van het eerste lid zou leiden tot kennelijke hardheid, is het Uitvoeringsinstituut werknemersverzekeringen bevoegd het recht op arbeidsongeschiktheidsuitkering ambtshalve toe te kennen."
BWBR0008657,Wet arbeidsongeschiktheidsvoorziening jonggehandicapten,Hoofdstuk1a,Arbeidsongeschiktheidsvoorziening voor jonggehandicapten,Paragraaf2,,Artikel1a:12,Recht op arbeidsongeschiktheidsuitkering,,,Artikel 1a:12,Overeenkomstige toepasselijkheid bepalingen hoofdstuk 3,"Met betrekking tot de jonggehandicapte en het recht op arbeidsongeschiktheidsuitkering op grond van dit hoofdstuk zijn de volgende artikelen en daarop berustende bepalingen van overeenkomstige toepassing: ter zake van onderzoek naar de mogelijkheden tot arbeidsparticipatie: de artikelen 3:12, 3:33, eerste lid, onderdeel b, tweede en derde lid, 3:34 en 3:36; ter zake van de verplichtingen van de jonggehandicapte: de artikelen 3:35, eerste lid, en 3:74, eerste en tweede lid; ter zake van maatregelen: de artikelen 3:37, 3:38, onderdelen a tot en met e en k, en 3:39, met dien verstande dat het tweede lid van overeenkomstige toepassing is, voor zover het ziet op het niet tijdig nakomen van de verplichting, bedoeld in artikel 3:74; ter zake van bestuurlijke boeten: de artikelen 3:40 en 3:43; ter zake van de grondslag van de uitkering: artikel 3:7, derde en vierde lid; ter zake van de tegemoetkoming in aanvulling op de arbeidsongeschiktheidsuitkering: de artikelen 3:10 en 3:53; ter zake van de vakantie-uitkering: de artikelen 3:24, 3:25, eerste, derde en vierde lid, 3:26, 3:32 en 3:52; ter zake van de overlijdensuitkering: artikel 3:54; ter zake van de betaling van de uitkering: de artikelen 3:45, eerste tot en met vierde lid, 3:47, 3:47a en 3:55; ter zake van herziening of intrekking: artikel 3:18; ter zake van terugvordering: de artikelen 3:56, 3:57, 3:58, 3:59 en 3:60; ter zake van vervreemding, verpanding en volmacht tot ontvangst: de artikelen 3:61 en 3:62. De strafbepaling van artikel 84, eerste lid, van de Wet structuur uitvoeringsorganisatie werk en inkomen is van overeenkomstige toepassing."
BWBR0008657,Wet arbeidsongeschiktheidsvoorziening jonggehandicapten,Hoofdstuk2,Arbeidsongeschiktheidsvoorziening voor jonggehandicapten ingestroomd van 2010 tot en met 2014,Afdeling1,Algemene bepalingen,Artikel2:1,,,,Artikel 2:1,Algemene bepaling,"In dit hoofdstuk en de daarop berustende bepalingen wordt verstaan onder grondslag: het minimumloon gedeeld door 21,75."
BWBR0008657,Wet arbeidsongeschiktheidsvoorziening jonggehandicapten,Hoofdstuk2,Arbeidsongeschiktheidsvoorziening voor jonggehandicapten ingestroomd van 2010 tot en met 2014,Afdeling1,Algemene bepalingen,Artikel2:2,,,,Artikel 2:2,Maatmaninkomen,"In dit hoofdstuk en de daarop berustende bepalingen wordt verstaan onder maatmaninkomen: het inkomen dat gezonde personen, met soortgelijke opleiding en ervaring, ter plaatse waar de jonggehandicapte woont of in de omgeving daarvan met arbeid gewoonlijk verdienen, waarbij, zoveel doenlijk, rekening wordt gehouden met door de jonggehandicapte verkregen nieuwe bekwaamheden. Bij of krachtens algemene maatregel van bestuur kan worden bepaald hoe het maatmaninkomen, bedoeld in het eerste lid, wordt vastgesteld."
