law_id,law_name,hoofdstuk,hoofdstuk_titel,afdeling,afdeling_titel,paragraaf,paragraaf_titel,subparagraaf_titel,titel_titel,artikel,article_name,text
BWBR0017017,Wet kinderopvang,Hoofdstuk1,Kinderopvang,Afdeling1,Algemene bepalingen,Artikel1.1,,,,Artikel 1.1,,"In deze wet en de op deze wet berustende bepalingen wordt verstaan onder: beroepskracht: de persoon van 18 jaar of ouder die werkzaam is bij een kindercentrum, bezoldigd is en belast is met de verzorging, de opvoeding en het bijdragen aan de ontwikkeling van kinderen; de persoon van 18 jaar of ouder die werkzaam is bij een gastouderbureau, bezoldigd is en belast is met het tot stand brengen en begeleiden van gastouderopvang; beroepskracht in opleiding: degene die beschikt over een arbeidsovereenkomst met de houder van een kindercentrum of van een gastouderbureau en ten behoeve van het praktijkdeel van de opleiding belast is met de verzorging, de opvoeding en het bijdragen aan de ontwikkeling van kinderen bij een kindercentrum of met het tot stand brengen en begeleiden van gastouderopvang bij een gastouderbureau; beroepskracht meertalige kinderopvang: degene die als beroepskracht werkzaam is en belast is met meertalige kinderopvang en die voldoet aan de opleidingseisen en scholingseisen, bedoeld in artikel 1.50, tweede lid, onderdeel b; beroepskracht voorschoolse educatie: degene die als beroepskracht werkzaam is en belast is met voorschoolse educatie en die voldoet aan de opleidingseisen en scholingseisen, bedoeld in artikel 1.50b, onderdeel a; buitenschoolse opvang: kinderopvang verzorgd door een kindercentrum voor kinderen in de leeftijd dat ze naar het basisonderwijs kunnen gaan, waarbij opvang wordt geboden voor of na de dagelijkse schooltijd evenals gedurende vrije dagen of middagen en in schoolvakanties; college: college van burgemeester en wethouders van de gemeente waar een kindercentrum, gastouderbureau of voorziening voor gastouderopvang is gevestigd of zal worden gevestigd; continentaal plat: de exclusieve economische zone van het Koninkrijk, bedoeld in artikel 1 van de Rijkswet instelling exclusieve economische zone, voor zover deze grenst aan de territoriale zee van Nederland; continue screening kinderopvang: de voortdurende uitwisseling van gegevens over ingeschrevenen in het personenregister kinderopvang door Onze Minister en Onze Minister van Veiligheid en Justitie voor de controle op nieuwe gegevens in de justitiële documentatie van de ingeschrevene op basis waarvan wordt beoordeeld of de ingeschrevene nog steeds voldoet aan de eisen zoals deze gelden bij de afgifte van een verklaring omtrent het gedrag; gastouder: degene van 18 jaar of ouder die gastouderopvang biedt, met uitzondering van degene: van wie een of meer kinderen onderworpen zijn aan ondertoezichtstelling of voorlopige ondertoezichtstelling als bedoeld in artikel 255, onderscheidenlijk artikel 257, van Boek 1 van het Burgerlijk Wetboek, die met betrekking tot een of meer van zijn kinderen is ontheven uit het ouderlijk gezag als bedoeld in artikel 266 van Boek 1 van het Burgerlijk Wetboek of die met betrekking tot een of meer van zijn kinderen is ontzet van het gezag als bedoeld in artikel 269 van Boek 1 van het Burgerlijk Wetboek, die op hetzelfde woonadres staat ingeschreven in de basisregistratie personen als de ouder of diens partner van het kind aan wie opvang wordt geboden, of die ten behoeve van de opvang van kinderen in enigerlei vorm personeel in dienst heeft; gastouderbureau: een organisatie die gastouderopvang tot stand brengt en begeleidt en door tussenkomst van wie de betaling van ouders aan gastouders geschiedt; gastouderopvang: kinderopvang: die plaatsvindt door tussenkomst van een geregistreerd gastouderbureau; die plaatsvindt in een gezinssituatie door een ander dan degene die als ouder op grond van artikel 1.5, eerste lid, aanspraak kan maken op een kinderopvangtoeslag of diens partner; waarbij de opvang plaatsvindt: op het woonadres van de gastouder, op het woonadres van een van de ouders van de kinderen voor wie de gastouder opvang biedt, dan wel op twee of meer van deze woonadressen; en bestaande uit de gelijktijdige opvang van ten hoogste zes kinderen, waaronder begrepen de bloedverwant of aanverwant in de neergaande lijn van de gastouder of zijn partner, die in belangrijke mate wordt onderhouden door de gastouder of zijn partner en op hetzelfde woonadres als de gastouder staat ingeschreven in de basisregistratie personen en de leeftijd van tien jaar nog niet heeft bereikt. Met een bloedverwant of aanverwant in de neergaande lijn wordt gelijkgesteld een pleegkind dat de leeftijd van tien jaar nog niet heeft bereikt; geregistreerd gastouderbureau: een in het landelijk register kinderopvang ingeschreven gastouderbureau als bedoeld in artikel 1.46, tweede lid; geregistreerd kindercentrum: een in het landelijk register kinderopvang ingeschreven kindercentrum als bedoeld in artikel 1.46, tweede lid; geregistreerde voorziening voor gastouderopvang: een in het landelijk register kinderopvang ingeschreven voorziening voor gastouderopvang als bedoeld in artikel 1.46, tweede lid; geschillencommissie: de commissie, bedoeld in artikel 1.57c, eerste lid; GGD: een gemeentelijke gezondheidsdienst als bedoeld in artikel 14 van de Wet publieke gezondheid; houder: degene aan wie een onderneming als bedoeld in de Handelsregisterwet 2007 toebehoort en die met die onderneming een kindercentrum of een gastouderbureau exploiteert; de gastouder die een voorziening voor gastouderopvang exploiteert. ingeschrevene: een persoon als bedoeld in artikel 1.48d, tweede lid, die in het personenregister kinderopvang is ingeschreven; justitiële documentatie: de documentatie, bedoeld in artikel 1, aanhef en onder e, van de Wet justitiële en strafvorderlijke gegevens; kindercentrum: een voorziening waar kinderopvang plaatsvindt, anders dan gastouderopvang; kinderopvang: het bedrijfsmatig of anders dan om niet verzorgen, opvoeden en bijdragen aan de ontwikkeling van kinderen tot de eerste dag van de maand waarop het voortgezet onderwijs voor die kinderen begint; kinderopvangtoeslag: een tegemoetkoming van het Rijk als bedoeld in artikel 2, eerste lid, onder h, van de Algemene wet inkomensafhankelijke regelingen in de kosten van kinderopvang; landelijk register kinderopvang: het register, bedoeld in artikel 1.47b, eerste lid; meertalige kinderopvang: kinderopvang als bedoeld in artikel 1.55, derde lid; Onze Minister: Onze Minister van Sociale Zaken en Werkgelegenheid; ouder: de bloed- of aanverwant in opgaande lijn of de pleegouder van een kind op wie de kinderopvang betrekking heeft, met dien verstande dat bij de beoordeling of sprake is van pleegouderschap een vergoeding op grond van de Jeugdwet buiten beschouwing blijft; oudercommissie: de commissie, bedoeld in artikel 1.58; ouderparticipatiecrèche: een kindercentrum waar ouderparticipatieopvang plaatsvindt; ouderparticipatieopvang: kinderopvang als bedoeld in artikel 1.60a; overheidswerkgever: de werkgever, bedoeld in artikel 1, onderdeel r, van de Wet financiering sociale verzekeringen; participerende ouder: ouder die ouderparticipatieopvang verzorgt en belast is met de verzorging, de opvoeding en het bijdragen aan de ontwikkeling van kinderen; pedagogisch beleidsmedewerker: de persoon van 18 jaar of ouder die werkzaam is bij een kindercentrum, bezoldigd is en belast is met de totstandkoming en implementatie van pedagogische beleidsvoornemens of het coachen van beroepskrachten bij de uitvoering van hun werkzaamheden; personenregister kinderopvang: de verzameling van gegevens die verwerkt worden ten behoeve van het doel, beschreven in artikel 1.48d, eerste lid; register buitenlandse kinderopvang: het register, bedoeld in artikel 1.48b, eerste lid; stagiair: degene die een opleiding volgt, waarvan het praktijkdeel een beperkt deel van de totale studieduur is, belast is met werkzaamheden bij de houder ten behoeve van het praktijkdeel van de opleiding en geen beroepskracht in opleiding is; Uitvoeringsinstituut werknemersverzekeringen: het Uitvoeringsinstituut werknemersverzekeringen, genoemd in hoofdstuk 5 van de Wet structuur uitvoeringsorganisatie werk en inkomen; uitvoeringskosten: de kosten die door een gastouderbureau in rekening worden gebracht bij de ouder of de gastouder, niet zijnde de kosten van gastouderopvang; uitzendkracht: degene van 18 jaar of ouder die werkzaam is voor een uitzendbureau en is uitgezonden voor werkzaamheden bij een kindercentrum of een gastouderbureau; verklaring omtrent het gedrag: een verklaring omtrent het gedrag natuurlijke personen of een verklaring omtrent het gedrag rechtspersonen; verklaring omtrent het gedrag natuurlijke personen: een verklaring omtrent het gedrag, afgegeven volgens de Wet justitiële en strafvorderlijke gegevens, ten behoeve van een natuurlijk persoon; verklaring omtrent het gedrag rechtspersonen: een verklaring omtrent het gedrag, afgegeven volgens de Wet justitiële en strafvorderlijke gegevens, ten behoeve van een rechtspersoon; voorschoolse educatie: uitvoering van een door het college gesubsidieerd programma dat gericht is op het verbeteren van de voorwaarden voor het met succes instromen in het basisonderwijs voor kinderen die nog niet tot een school kunnen worden toegelaten; voorziening voor gastouderopvang: gastouderopvang door een specifieke gastouder op een specifiek woonadres. Tot kinderopvang worden niet gerekend: het toezichthouden op schoolgaande kinderen dat zich beperkt tot het toezicht tijdens de middagpauze; verzorging en opvoeding die plaatsvindt in het kader van de Jeugdwet; de verzorging, de opvoeding en het bijdragen aan de ontwikkeling van kinderen, anders dan gastouderopvang, die geschiedt op een plaats waar het kind zijn hoofdverblijf heeft. Waar in het bepaalde bij of krachtens dit hoofdstuk en hoofdstuk 3 wordt gesproken over verklaring omtrent het gedrag wordt een verklaring omtrent het gedrag natuurlijke personen bedoeld, indien de betrokkene een natuurlijk persoon is en een verklaring omtrent het gedrag rechtspersonen, indien de betrokkene een rechtspersoon is."
BWBR0017017,Wet kinderopvang,Hoofdstuk1,Kinderopvang,Afdeling1,Algemene bepalingen,Artikel1.1a,,,,Artikel 1.1a,,Vervallen
BWBR0017017,Wet kinderopvang,Hoofdstuk1,Kinderopvang,Afdeling1,Algemene bepalingen,Artikel2,,,,Artikel 2,,Vervallen
BWBR0017017,Wet kinderopvang,Hoofdstuk1,Kinderopvang,Afdeling2,Kinderopvangtoeslag,Paragraaf1,Uitvoering van de kinderopvangtoeslag,,,Artikel 1.3,,"De uitvoering van het toekennen, uitbetalen en terugvorderen van de kinderopvangtoeslag is opgedragen aan de Dienst Toeslagen. Op deze wet is de Algemene wet inkomensafhankelijke regelingen van toepassing met uitzondering van artikel 5 van die wet op wijzigingen in de kosten van kinderopvang per kind, bedoeld in artikel 1.7, eerste lid, onderdeel b, met dien verstande dat: in afwijking van artikel 4, derde lid, van de Algemene wet inkomensafhankelijke regelingen een kind voor wie de pleegouder een vergoeding ontvangt op grond van de Jeugdwet, geacht wordt door die pleegouder in belangrijke mate te worden onderhouden; in afwijking van artikel 15, eerste lid, van de Algemene wet inkomensafhankelijke regelingen, een ouder over de berekeningsjaren 2014 en volgende geen aanspraak heeft op kinderopvangtoeslag als bedoeld in artikel 1.5 over de periode tot de eerste dag van de kalendermaand die drie kalendermaanden gelegen is voor de datum waarop de aanvraag om kinderopvangtoeslag is ingediend bij de Dienst Toeslagen."
BWBR0017017,Wet kinderopvang,Hoofdstuk1,Kinderopvang,Afdeling2,Kinderopvangtoeslag,Paragraaf1,Uitvoering van de kinderopvangtoeslag,,,Artikel 1.4,,"Met het oog op het toekennen van een kinderopvangtoeslag verstrekt de ouder, bedoeld in artikel 1.5, eerste lid, aan de Dienst Toeslagen het unieke nummer, bedoeld in artikel 1.47b, derde lid. Bij ministeriële regeling kunnen voorschriften worden gegeven met betrekking tot de verstrekking."
BWBR0017017,Wet kinderopvang,Hoofdstuk1,Kinderopvang,Afdeling2,Kinderopvangtoeslag,Paragraaf2,Aanspraak op kinderopvangtoeslag,,,Artikel 1.5,,"Een ouder heeft aanspraak op een kinderopvangtoeslag in de door hem of zijn partner betaalde kosten, indien het betreft: kinderopvang in een geregistreerd kindercentrum; of gastouderopvang in een geregistreerde voorziening voor gastouderopvang. Indien het ouderparticipatieopvang in een ouderparticipatiecrèche betreft, heeft de ouder in de aanloopperiode, bedoeld in artikel 1.60b, in afwijking van het eerste lid, geen aanspraak op kinderopvangtoeslag. Een ouder en diens partner die tevens ouder is worden voor de toepassing van deze wet geacht gezamenlijk één aanspraak te hebben."
BWBR0017017,Wet kinderopvang,Hoofdstuk1,Kinderopvang,Afdeling2,Kinderopvangtoeslag,Paragraaf2,Aanspraak op kinderopvangtoeslag,,,Artikel 1.6,,"Een ouder heeft voor een berekeningsjaar aanspraak op een kinderopvangtoeslag, indien de ouder in dat jaar: tegenwoordige arbeid verricht waaruit inkomen uit werk en woning in de zin van de Wet inkomstenbelasting 2001 wordt genoten, zonder enige vergoeding arbeid verricht in de onderneming van de partner in de zin van artikel 3.78 van de Wet inkomstenbelasting 2001, algemene bijstand of een uitkering ontvangt op grond van de Participatiewet, de Wet inkomensvoorziening oudere en gedeeltelijk arbeidsongeschikte werkloze werknemers, de Wet inkomensvoorziening oudere en gedeeltelijk arbeidsongeschikte gewezen zelfstandigen of de Algemene nabestaandenwet, en gebruik maakt van een voorziening, gericht op arbeidsinschakeling als bedoeld in artikel 7, eerste lid, onder a, van de Participatiewet, artikel 34, eerste lid, onder a, van de Wet inkomensvoorziening oudere en gedeeltelijk arbeidsongeschikte werkloze werknemers en artikel 34, eerste lid, onder a, van de Wet inkomensvoorziening oudere en gedeeltelijk arbeidsongeschikte gewezen zelfstandigen, die de noodzaak tot kinderopvang met zich brengt, vervallen, de leeftijd van 18 jaar nog niet heeft bereikt, scholing of een opleiding volgt en met toepassing van artikel 16 of artikel 18, eerste en twaalfde lid, van de Participatiewet algemene bijstand ontvangt of kan ontvangen, als niet-uitkeringsgerechtigde werkzoekende is geregistreerd bij het Uitvoeringsinstituut werknemersverzekeringen, genoemd in hoofdstuk 5 van de Wet structuur uitvoeringsorganisatie werk en inkomen, en gebruik maakt van een voorziening gericht op arbeidsinschakeling als bedoeld in artikel 7, eerste lid, onder a, van de Participatiewet, inburgeringsplichtig is op grond van de Wet inburgering 2021 en een cursus of opleiding volgt waarmee hij aan de op grond van artikel 15 van die wet vastgestelde leerroute kan voldoen, voor zover de inburgeringsplichtige het taalschakeltraject, bedoeld in artikel 8, tweede lid, van die wet, volgt, dan wel de cursusinstelling waar die cursus of opleiding wordt gevolgd in het bezit is van een certificaat als bedoeld in artikel 28 van die wet of een keurmerk als bedoeld in artikel 32 van die wet, of, indien het een inburgeringsplichtige als bedoeld in artikel 13, eerste lid, van die wet betreft, de opleiding of cursus wordt aangeboden door het college als bedoeld in artikel 16, eerste lid, van die wet, recht heeft op of een uitkering ontvangt op grond van de Werkloosheidswet en deelneemt aan scholing als bedoeld in artikel 76 van die wet of werkzaamheden verricht als bedoeld in artikel 76a of 77a van die wet met behoud van die uitkering dan wel op andere wijze deelneemt aan een traject gericht op arbeidsinschakeling, recht heeft op een arbeidsongeschiktheidsuitkering op grond van de Wet op de arbeidsongeschiktheidsverzekering, de Wet arbeidsongeschiktheidsvoorziening jonggehandicapten, de Wet arbeidsongeschiktheidsverzekering zelfstandigen, arbeidsondersteuning op grond van de Wet arbeidsongeschiktheidsvoorziening jonggehandicapten of een uitkering op grond van hoofdstuk 7 van de Wet werk en inkomen naar arbeidsvermogen of recht heeft op ziekengeld op grond van de Ziektewet: ten behoeve van wie het Uitvoeringsinstituut werknemersverzekeringen werkzaamheden, gericht op de bevordering van de inschakeling in het arbeidsproces als bedoeld in artikel 30a, achtste lid, van de Wet structuur uitvoeringsorganisatie werk en inkomen laat verrichten, ten behoeve van wie de eigenrisicodrager, bedoeld in artikel 82 van de Wet werk en inkomen naar arbeidsvermogen, onderscheidenlijk artikel 63a van de Ziektewet, werkzaamheden, gericht op de bevordering van de inschakeling in het arbeidsproces als bedoeld in artikel 42 van de Wet werk en inkomen naar arbeidsvermogen, onderscheidenlijk artikel 63a, eerste lid, tweede volzin, van de Ziektewet, laat verrichten, of werkzaamheden op een proefplaats verricht als bedoeld in artikel 65g van de Wet op de arbeidsongeschiktheidsverzekering, artikel 2:24 of 3:69 van de Wet arbeidsongeschiktheidsvoorziening jonggehandicapten, artikel 67e van de Wet arbeidsongeschiktheidsverzekering zelfstandigen, artikel 37 van de Wet werk en inkomen naar arbeidsvermogen of artikel 52e van de Ziektewet, is ingeschreven bij een school of instelling, voor het volgen van: voorbereidend wetenschappelijk onderwijs, hoger of middelbaar algemeen voortgezet onderwijs, voorbereidend beroepsonderwijs, praktijkonderwijs of andere vormen van voortgezet onderwijs als bedoeld in artikel 5, van de Wet op het voortgezet onderwijs of artikel 14, eerste lid, van de Wet op de expertisecentra; een opleiding voortgezet algemeen volwassenenonderwijs als bedoeld in artikel 7.3.1, eerste lid, onderdeel a, van de Wet educatie en beroepsonderwijs; een beroepsopleiding als bedoeld in artikel 7.1.2, tweede lid, van de Wet educatie en beroepsonderwijs die verzorgd wordt door een instelling als bedoeld in artikel 1.1.1 van die wet, of door een instelling die op grond van artikel 1.4.1 van de Wet educatie en beroepsonderwijs bevoegd is een diploma uit te reiken voor die opleiding; of een associate degree-opleiding, een bacheloropleiding, een masteropleiding of een postinitiële masteropleiding als bedoeld in de artikelen 7.3a of 7.3b van de Wet op het hoger onderwijs en wetenschappelijk onderzoek, waarvoor accreditatie is verleend of die een toets nieuwe opleiding met positief gevolg heeft ondergaan;. dit onderdeel is nog niet in werking getreden; dit onderdeel is nog niet in werking getreden. Een ouder die niet in Nederland woont, heeft slechts aanspraak op een kinderopvangtoeslag indien hij in een andere lidstaat of Zwitserland woont en, daartoe gerechtigd, in Nederland of op het continentaal plat tegenwoordige arbeid verricht waaruit inkomen uit werk en woning in de zin van de Wet inkomstenbelasting 2001 wordt genoten of een uitkering ontvangt als bedoeld in het eerste lid, onder c, e, h of i, en gebruik maakt van een in één van die onderdelen bedoelde voorziening gericht op arbeidsinschakeling. Een ouder met een partner heeft slechts aanspraak op een kinderopvangtoeslag, indien de partner in Nederland, een andere lidstaat of Zwitserland woont, en in Nederland of op het continentaal plat, in een andere lidstaat of in Zwitserland tegenwoordige arbeid verricht waaruit inkomen uit werk en woning in de zin van de Wet inkomstenbelasting 2001 wordt genoten, een uitkering ontvangt als bedoeld in het eerste lid, onder c, e, h of i, en gebruik maakt van een in één van die onderdelen bedoelde voorziening gericht op arbeidsinschakeling of een daarmee vergelijkbare uitkering respectievelijk voorziening, vastgesteld krachtens de wetgeving van een andere lidstaat of Zwitserland, een persoon is als bedoeld in het eerste lid, onder f, g, j, k of l, een persoon is als bedoeld in het eerste lid, onder b. Voor de toepassing van deze wet wordt met inkomen uit werk en woning als bedoeld in het eerste lid, onderdeel a en het derde lid, onderdeel a, gelijkgesteld een daarmee overeenkomend inkomen dat niet tot het verzamelinkomen van de ouder of het verzamelinkomen van de partner behoort omdat het niet behoort tot het Nederlands inkomen als bedoeld in hoofdstuk 7 van de Wet inkomstenbelasting 2001, of is vrijgesteld op grond van bepalingen van internationaal recht. Een ouder of zijn partner die in een berekeningsjaar of in het daaraan voorafgaande berekeningsjaar tegenwoordige arbeid heeft verricht als bedoeld in het eerste lid, onderdeel a of b, of derde lid, onderdeel a of d, behoudt gedurende drie kalendermaanden, gerekend vanaf de eerste dag na de dag waarop het verrichten van die arbeid is beëindigd, dezelfde aanspraak op een kinderopvangtoeslag als voor die beëindiging. Indien de periode van drie maanden, bedoeld in de vorige zin, samenvalt met de periode die loopt van 28 dagen voor de datum van de vermoedelijke bevalling van de persoon, wiens arbeid is beëindigd, tot 42 dagen na diens bevalling, wordt de periode, bedoeld in de vorige zin, verlengd met de periode waarin deze perioden samenvielen. Het derde lid is niet van toepassing op een ouder met een partner indien de partner: in Nederland, een andere lidstaat of Zwitserland woont, op grond van artikel 1.2, eerste lid, onderdeel e, van de Wet inkomstenbelasting 2001 of artikel 3, tweede lid, onderdeel e, van de Algemene wet inkomensafhankelijke regelingen partner is van de ouder, en bloed- of aanverwant is van de ouder in de rechte lijn of in de tweede graad van de zijlijn. Indien de tegenwoordige arbeid, als bedoeld in het eerste lid, onderdeel a of b, of derde lid, onderdeel a of d, van een ouder of zijn partner in een bij algemene maatregel van bestuur te bepalen berekeningsjaar is beëindigd, behoudt de ouder in afwijking van het vijfde lid, gedurende zes kalendermaanden dezelfde aanspraak op een kinderopvangtoeslag indien sprake van omstandigheden als bedoeld in het vijfde lid. Indien de periode van zes maanden, bedoeld in de vorige zin, samenvalt met de periode die loopt van 28 dagen voor de datum van de vermoedelijke bevalling van de persoon, wiens arbeid is beëindigd, tot 42 dagen na diens bevalling, wordt de periode, bedoeld in de vorige zin, verlengd met de periode waarin deze perioden samenvielen. Een ouder als bedoeld in het eerste en tweede lid, met een partner, heeft voor een berekeningsjaar aanspraak op een kinderopvangtoeslag, indien de partner in Nederland, een andere lidstaat of Zwitserland woont en een verzekerde is die recht op zorg heeft op grond van artikel 3.2.1, eerste lid, 3.2.1, derde lid, of 3.2.2, van de Wet langdurige zorg of op grond van artikel 11.1.1, van de Wet langdurige zorg is gelijkgesteld met een verzekerde ten aanzien van wie het CIZ heeft vastgesteld dat hij voldoet aan artikel 3.2.1, eerste of derde lid, van de Wet langdurige zorg. Een ouder die een verzekerde is die recht op zorg heeft op grond van artikel 3.2.1, eerste lid, 3.2.1, derde lid, of 3.2.2, van de Wet langdurige zorg of op grond van artikel 11.1.1 van de Wet langdurige zorgis gelijkgesteld met een verzekerde ten aanzien van wie het CIZ heeft vastgesteld dat hij voldoet aan artikel 3.2.1, eerste of derde lid, van de Wet langdurige zorg, heeft voor een berekeningsjaar aanspraak op een kinderopvangtoeslag, indien de ouder een partner heeft die in Nederland, een andere lidstaat of Zwitserland woont, en in Nederland of op het continentaal plat, in een andere lidstaat of in Zwitserland, tegenwoordige arbeid verricht waaruit inkomen uit werk en woning in de zin van de Wet inkomstenbelasting 2001 wordt genoten; een uitkering ontvangt als bedoeld in het eerste lid, onder c, e, h of i, en gebruik maakt van een in één van die onderdelen bedoelde voorziening gericht op arbeidsinschakeling of een daarmee vergelijkbare uitkering respectievelijk voorziening, vastgesteld krachtens de wetgeving van een andere lidstaat of Zwitserland; of een persoon is als bedoeld in het eerste lid, onder b, f, g, j, k of l. Een ouder als bedoeld in het eerste en tweede lid, met een partner, heeft voor een berekeningsjaar aanspraak op een kinderopvangtoeslag, indien de partner in Nederland, een andere lidstaat of Zwitserland woont en de partner is veroordeeld tot een vrijheidsbenemende straf of maatregel van langer dan drie maanden, gedurende de periode waarin die straf of maatregel ten uitvoer wordt gelegd. Een ouder die is veroordeeld tot een vrijheidsbenemende straf of maatregel van langer dan drie maanden, heeft, gedurende de periode waarin die straf of maatregel ten uitvoer wordt gelegd, voor een berekeningsjaar aanspraak op een kinderopvangtoeslag, indien de ouder een partner heeft die in Nederland, een andere lidstaat of Zwitserland woont, en in Nederland of op het continentaal plat, in een andere lidstaat of in Zwitserland, tegenwoordige arbeid verricht waaruit inkomen uit werk en woning in de zin van de Wet inkomstenbelasting 2001 wordt genoten; een uitkering ontvangt als bedoeld in het eerste lid, onder c, e, h of i, en gebruik maakt van een in één van die onderdelen bedoelde voorziening gericht op arbeidsinschakeling of een daarmee vergelijkbare uitkering respectievelijk voorziening, vastgesteld krachtens de wetgeving van een andere lidstaat of Zwitserland; of een persoon is als bedoeld in het eerste lid, onder b, f, g, j, k of l."
BWBR0017017,Wet kinderopvang,Hoofdstuk1,Kinderopvang,Afdeling2,Kinderopvangtoeslag,Paragraaf2,Aanspraak op kinderopvangtoeslag,,,Artikel 1.6a,,"In afwijking van de artikelen 1.5 en 1.6, heeft een ouder als bedoeld in artikel 1.6, eerste lid, onderdeel a, voor zover die ouder de arbeid verricht als gastouder, geen aanspraak op een kinderopvangtoeslag in de door hem of zijn partner te betalen kosten van gastouderopvang in een geregistreerde voorziening voor gastouderopvang."
