law_id,law_name,hoofdstuk,hoofdstuk_titel,afdeling,afdeling_titel,paragraaf,paragraaf_titel,subparagraaf_titel,titel_titel,artikel,article_name,text
BWBR0036745,Wet auteurscontractenrecht,ArtikelI,,,,,,,,Artikel I,,Wijzigt de Auteurswet.
BWBR0036745,Wet auteurscontractenrecht,ArtikelII,,,,,,,,Artikel II,,Wijzigt de Wet op de naburige rechten.
BWBR0036745,Wet auteurscontractenrecht,ArtikelIII,,,,,,,,Artikel III,,"Het recht zoals dat gold voor het tijdstip van inwerkingtreding blijft van toepassing op overeenkomsten die voor dat tijdstip zijn gesloten, met dien verstande dat de artikelen 25e, eerste tot en met vijfde lid en het zevende lid en artikel 25f en artikel 25fa van de Auteurswet wel van toepassing zijn op overeenkomsten die voor het tijdstip van inwerkingtreding zijn gesloten, alsmede artikel 45d, zevende lid, van de Auteurswet en artikel 2b van de Wet op de naburige rechten voorzover in die artikelen artikel 25e eerste tot en met vijfde lid en het zevende lid en artikel 25f van de Auteurswet van overeenkomstige toepassing zijn verklaard. In afwijking van het in het eerste lid bepaalde blijft het recht zoals dat gold voor het tijdstip van inwerkingtreding van toepassing op filmwerken die voor dat tijdstip zijn voltooid, met dien verstande dat de artikelen 25e, eerste tot en met vijfde lid en het zevende lid en artikel 25f en artikel 25fa van de Auteurswet wel van toepassing zijn op filmwerken die voor het tijdstip van inwerkingtreding zijn voltooid, alsmede artikel 45d, zevende lid, van de Auteurswet en artikel 2b van de Wet op de naburige rechten voorzover in die artikelen artikel 25e eerste tot en met vijfde lid en het zevende lid en artikel 25f van de Auteurswet van overeenkomstige toepassing zijn verklaard. In afwijking van het in het eerste en tweede lid bepaalde is het recht op een proportionele billijke vergoeding als bedoeld in artikel 45d, tweede en derde lid, van de Auteurswet vanaf het tijdstip van inwerkingtreding van toepassing op het uitzenden of doen uitzenden en op enige andere wijze mededelen aan het publiek zoals bedoeld in artikel 45d lid 2, van een filmwerk."
BWBR0036745,Wet auteurscontractenrecht,ArtikelIV,,,,,,,,Artikel IV,,De artikelen van deze wet treden in werking op een bij koninklijk besluit te bepalen tijdstip dat voor de verschillende artikelen of onderdelen daarvan verschillend kan worden vastgesteld.
BWBR0036745,Wet auteurscontractenrecht,ArtikelV,,,,,,,,Artikel V,,Deze wet kan worden aangehaald als de Wet auteurscontractenrecht.
